{
  "schemaVersion": 1,
  "protocol": "afterburner.ui",
  "revision": 1,
  "surfaceId": "surface-terminal-main",
  "baseRevision": 7,
  "nextRevision": 8,
  "operations": [
    {
      "op": "replace",
      "path": "/root/children/0/props/status",
      "value": "ready",
      "reason": "terminal became interactive"
    }
  ]
}
